{
  "$schema": "https://json-schema.org/draft/2020-12/schema",
  "title": "WorksheetPlan",
  "description": "墨灵 v0.3 临摹练习计划结构，不含 AI 评测或评分。",
  "type": "object",
  "$comment": "本文件由 schemas.py 经 export_schemas.py 自动生成，请勿直接编辑。总填写字格数须符合 5/15/30 分钟对应 12/36/72 格的暂定规则，该跨字段计算由 Python model_validator 校验，未完整表达在 JSON Schema 中。配额未经教学验证；输入输出书体、时长的一致性由调用流程保证。",
  "$defs": {
    "WorksheetItem": {
      "additionalProperties": false,
      "description": "一项临摹练习：一个连续汉字词组及整组重复次数，不包含评分。",
      "properties": {
        "text": {
          "description": "一个字或词，仅接受基本区与扩展 A 区汉字，不含空格或标点；词语边界由内容提供者保证。",
          "minLength": 1,
          "pattern": "^[\\u3400-\\u4dbf\\u4e00-\\u9fff]+$",
          "title": "练习字词",
          "type": "string"
        },
        "repeat": {
          "description": "整个 text 重复的次数；课堂重复 3 次占 6 个填写字格，不含范字。",
          "exclusiveMinimum": 0,
          "title": "整组重复次数",
          "type": "integer"
        },
        "task_type": {
          "const": "临摹",
          "description": "第一版仅支持看范字临摹，不支持描红、默写或纠错。",
          "title": "练习形式",
          "type": "string"
        },
        "instruction": {
          "anyOf": [
            {
              "type": "string"
            },
            {
              "type": "null"
            }
          ],
          "default": null,
          "description": "可省略或为 null，只作练习建议，不是评分或过关判定。",
          "title": "练习指导语"
        }
      },
      "required": [
        "text",
        "repeat",
        "task_type"
      ],
      "title": "WorksheetItem",
      "type": "object"
    }
  },
  "additionalProperties": false,
  "properties": {
    "schema_version": {
      "const": "0.3",
      "description": "墨灵计划格式版本，与 $schema 指定的 JSON Schema 标准版本不同。",
      "title": "业务协议版本",
      "type": "string"
    },
    "plan_id": {
      "description": "当前模块每次调用生成新的 UUID 字符串；字段仅校验非空，不承诺请求幂等。",
      "minLength": 1,
      "title": "计划编号",
      "type": "string"
    },
    "plan_name": {
      "description": "面向用户的显示名称。",
      "minLength": 1,
      "title": "计划名称",
      "type": "string"
    },
    "style": {
      "description": "应与需求书体一致；具体字体文件、授权及字形覆盖由渲染端确认。",
      "enum": [
        "楷书",
        "行书",
        "行楷"
      ],
      "title": "书体",
      "type": "string"
    },
    "duration_minutes": {
      "description": "单位分钟，应与输入一致；仅支持 5、15、30，不自动映射其他时长。",
      "enum": [
        5,
        15,
        30
      ],
      "title": "目标练习时长",
      "type": "integer"
    },
    "is_mock": {
      "description": "当前固定候选生成器必须返回 true，不表示已完成个性化选词。",
      "title": "是否为模拟数据",
      "type": "boolean"
    },
    "items": {
      "description": "按列表顺序展示范字及空白练习格，至少包含一项。",
      "items": {
        "$ref": "#/$defs/WorksheetItem"
      },
      "minItems": 1,
      "title": "练习清单",
      "type": "array"
    }
  },
  "required": [
    "schema_version",
    "plan_id",
    "plan_name",
    "style",
    "duration_minutes",
    "is_mock",
    "items"
  ]
}
